"code","message","type","context","selector"
"WCAG2AAA.Principle2.Guideline2_4.2_4_2.H25.1.NoTitleEl","A title should be provided for the document, using a non-empty title element in the head section.","error","<head>\n    <meta http-equiv=\"Content-...</head>","html > head"
"WCAG2AAA.Principle3.Guideline3_1.3_1_1.H57.2","The html element should have a lang or xml:lang attribute which describes the language of the document.","error","<html xmlns=\"http://www.w3.org/1999/xhtml\"><head>\n    <meta http-equiv=\"Co...</html>","html"
"WCAG2AAA.Principle1.Guideline1_1.1_1_1.G94.Image","Ensure that the img element's alt text serves the same purpose and presents the same information as the image.","notice","<img src=\"https://www.siliconpractice.co.uk/wp-content/themes/sp/images/si_logo.png\" alt=\"Ubuntu Logo\" class=\"floating_element\">","html > body > div > div:nth-child(1) > img"
"WCAG2AAA.Principle1.Guideline1_1.1_1_1.G73,G74","If this image cannot be fully described in a short text alternative, ensure a long text alternative is also available, such as in the body text or through a link.","notice","<img src=\"https://www.siliconpractice.co.uk/wp-content/themes/sp/images/si_logo.png\" alt=\"Ubuntu Logo\" class=\"floating_element\">","html > body > div > div:nth-child(1) > img"
"WCAG2AAA.Principle1.Guideline1_4.1_4_6.G17.Fail","This element has insufficient contrast at this conformance level. Expected a contrast ratio of at least 7:1, but text in this element has a contrast ratio of 5.35:1. Recommendation: change background to #212121.","error","<div class=\"section_header section_header_red\">\n          <div id=\"about\"></di...</div>","html > body > div > div:nth-child(2) > div:nth-child(1)"